,id,conversation_id,created_at,date,timezone,place,tweet,language,hashtags,cashtags,user_id,user_id_str,username,name,day,hour,link,urls,photos,video,thumbnail,retweet,nlikes,nreplies,nretweets,quote_url,search,near,geo,source,user_rt_id,user_rt,retweet_id,reply_to,retweet_date,translate,trans_src,trans_dest
228,1558923429528698881,1558923429528698881,1660511283000.0,2022-08-14 21:08:03,+0000,,Prices of battery metals have spiked and are expected to push battery costs up this year for the first time in more than a decade  https://t.co/vXI2nopZl3,en,[],[],5988062,5988062,TheEconomist,The Economist,7,21,https://twitter.com/TheEconomist/status/1558923429528698881,['https://econ.st/3QF2t0A'],[],0,,False,54,11,23,,None,,,,,,,[],,,,
229,1558916144861483011,1558916144861483011,1660509546000.0,2022-08-14 20:39:06,+0000,,"At the heart of the inflation shock is not whether central bankers can bring down prices, but whether the underlying inflation dynamic has changed   https://t.co/kUIdZYrrHg",en,[],[],5988062,5988062,TheEconomist,The Economist,7,20,https://twitter.com/TheEconomist/status/1558916144861483011,['https://econ.st/3BXmmf5'],[],0,,False,32,4,10,,None,,,,,,,[],,,,
230,1558913850271047682,1558913850271047682,1660508999000.0,2022-08-14 20:29:59,+0000,,"Thanks to a mostly unified market for natural gas European countries face similar wholesale prices. Yet countries differ in their dependence on the stuff, which affects their vulnerability to soaring prices   https://t.co/W1l9eMmrIj",en,[],[],5988062,5988062,TheEconomist,The Economist,7,20,https://twitter.com/TheEconomist/status/1558913850271047682,['https://econ.st/3SKqWDx'],[],0,,False,22,3,5,,None,,,,,,,[],,,,
231,1558909095624802306,1558909095624802306,1660507866000.0,2022-08-14 20:11:06,+0000,,The raid conjured a Trumpian Eden: the nation’s eyes were riveted upon Mr Trump once again  https://t.co/MhJF2tesbN,en,[],[],5988062,5988062,TheEconomist,The Economist,7,20,https://twitter.com/TheEconomist/status/1558909095624802306,['https://econ.st/3bHHVpx'],[],0,,False,58,28,13,,None,,,,,,,[],,,,
232,1558908113507475457,1558908113507475457,1660507632000.0,2022-08-14 20:07:12,+0000,,Edward Chancellor blames low interest rates for almost every ill he can find in the American and world economies. Ben Bernanke wishes he had loosened monetary policy even more  https://t.co/XjFKk5OQDY,en,[],[],5988062,5988062,TheEconomist,The Economist,7,20,https://twitter.com/TheEconomist/status/1558908113507475457,['https://econ.st/3QjQHck'],[],0,,False,40,6,9,,None,,,,,,,[],,,,
233,1558906846873878529,1558906846873878529,1660507330000.0,2022-08-14 20:02:10,+0000,,"Joe Biden was right to talk to Muhammad bin Salman, the crown prince of Saudi Arabia. Emmanuel Macron is right to talk to Vladimir Putin. Everyone needs to talk to China’s president, Xi Jinping   https://t.co/KsxZNzoV6K",en,[],[],5988062,5988062,TheEconomist,The Economist,7,20,https://twitter.com/TheEconomist/status/1558906846873878529,['https://econ.st/3vQ7CLf'],[],0,,False,105,9,30,,None,,,,,,,[],,,,
234,1558901301722988544,1558901301722988544,1660506007000.0,2022-08-14 19:40:07,+0000,,"Even if the heavens open, climate change threatens to make the problem of insufficient rainfall a regular occurrence. To mitigate that, some farmers are changing the way they farm  https://t.co/ca2XrgARq6",en,[],[],5988062,5988062,TheEconomist,The Economist,7,19,https://twitter.com/TheEconomist/status/1558901301722988544,['https://econ.st/3vWf0of'],[],0,,False,62,4,15,,None,,,,,,,[],,,,
235,1558900270372880384,1558900270372880384,1660505762000.0,2022-08-14 19:36:02,+0000,,"Generally: a period of significant decline in economic activity. But, inevitably, there is more to it than that  https://t.co/e9EAaMVKnC",en,[],[],5988062,5988062,TheEconomist,The Economist,7,19,https://twitter.com/TheEconomist/status/1558900270372880384,['https://econ.st/3C3GDzM'],[],0,,False,42,6,11,,None,,,,,,,[],,,,
236,1558899512718000131,1558899512718000131,1660505581000.0,2022-08-14 19:33:01,+0000,,"If you’re about to start an economics degree, these five books will get you thinking like an economist  https://t.co/544Z6w2Mlh",en,[],[],5988062,5988062,TheEconomist,The Economist,7,19,https://twitter.com/TheEconomist/status/1558899512718000131,['https://econ.st/3Ac1nUw'],[],0,,False,104,6,16,,None,,,,,,,[],,,,
237,1558896254310092806,1558896254310092806,1660504804000.0,2022-08-14 19:20:04,+0000,,"What assets will allow investors to sleep soundly in a period of recurrent inflation? Alternatives like private equity and credit are a good way to diversify, a new paper argues—but that may be an illusion   https://t.co/uRCH1vsuAm",en,[],[],5988062,5988062,TheEconomist,The Economist,7,19,https://twitter.com/TheEconomist/status/1558896254310092806,['https://econ.st/3zOKuOl'],[],0,,False,29,7,5,,None,,,,,,,[],,,,
238,1558891758532050949,1558891758532050949,1660503732000.0,2022-08-14 19:02:12,+0000,,A much-vaunted operation in southern Kherson province seems to have been overhyped. That may be intentional  https://t.co/f9LknolH2f,en,[],[],5988062,5988062,TheEconomist,The Economist,7,19,https://twitter.com/TheEconomist/status/1558891758532050949,['https://econ.st/3C5wfHB'],[],0,,False,61,11,19,,None,,,,,,,[],,,,
239,1558886191092604928,1558886191092604928,1660502405000.0,2022-08-14 18:40:05,+0000,,The danger is that China uses the crisis to impose even stricter limits on the island’s dealings with the rest of the world. That must not happen  https://t.co/vb48ccDfqF,en,[],[],5988062,5988062,TheEconomist,The Economist,7,18,https://twitter.com/TheEconomist/status/1558886191092604928,['https://econ.st/3bTjXYj'],[],0,,False,96,13,34,,None,,,,,,,[],,,,
240,1558884922357604354,1558884922357604354,1660502102000.0,2022-08-14 18:35:02,+0000,,"For Germany to make a sus­tained commitment to change, a sustained challenge is needed   https://t.co/f81gTcmg0L",en,[],[],5988062,5988062,TheEconomist,The Economist,7,18,https://twitter.com/TheEconomist/status/1558884922357604354,['https://econ.st/3QpO74r'],[],0,,False,40,5,6,,None,,,,,,,[],,,,
241,1558884427245174785,1558884427245174785,1660501984000.0,2022-08-14 18:33:04,+0000,,"Ghana routinely notches up impressive economic growth: its GDP per head is nearly twice the west African norm. One reason it has succeeded despite its fiscal recklessness is because, largely, it has gone to the IMF early and often  https://t.co/YYHO5bb5RA",en,[],[],5988062,5988062,TheEconomist,The Economist,7,18,https://twitter.com/TheEconomist/status/1558884427245174785,['https://econ.st/3BUKQ8V'],[],0,,False,34,3,11,,None,,,,,,,[],,,,
242,1558882160651784194,1558882160651784194,1660501444000.0,2022-08-14 18:24:04,+0000,,The ensuing drought has worsened many problems the bloc already faces as a result of the war in Ukraine and the pandemic  https://t.co/a2IoYuG26w  https://t.co/yr6kRBcVxe,en,[],[],5988062,5988062,TheEconomist,The Economist,7,18,https://twitter.com/TheEconomist/status/1558882160651784194,['https://econ.st/3drvsqa'],['https://pbs.twimg.com/media/FaJDEBIWAAAwSbA.jpg'],1,https://pbs.twimg.com/media/FaJDEBIWAAAwSbA.jpg,False,119,12,32,,None,,,,,,,[],,,,
243,1558877893836554243,1558877893836554243,1660500427000.0,2022-08-14 18:07:07,+0000,,Want to live well? Head to the capital of Austria👇  https://t.co/T8XMmE7HOS  Photo: Getty Images  https://t.co/7SDWp3tm4s,en,[],[],5988062,5988062,TheEconomist,The Economist,7,18,https://twitter.com/TheEconomist/status/1558877893836554243,['https://econ.st/3zHA4Ae'],['https://pbs.twimg.com/media/FaI_LuUWQAEmV-8.jpg'],1,https://pbs.twimg.com/media/FaI_LuUWQAEmV-8.jpg,False,291,19,53,,None,,,,,,,[],,,,
244,1558876379134959617,1558876379134959617,1660500065000.0,2022-08-14 18:01:05,+0000,,"“There’s going to be an enormous surge in green investment.”  @chowardchoward says that even though much of the Inflation Reduction Act will take time to affect voters, the Democrats could see an immediate benefit. Listen to “Checks and Balance”  https://t.co/19WiQkltif",en,[],[],5988062,5988062,TheEconomist,The Economist,7,18,https://twitter.com/TheEconomist/status/1558876379134959617,['https://econ.st/3AfJBQu'],[],0,,False,39,8,3,,None,,,,,,,[],,,,
245,1558872598343290886,1558872598343290886,1660499164000.0,2022-08-14 17:46:04,+0000,,"A UN monitoring panel reckons that jihadists in the Sahel and elsewhere must be crushed, or “one or more of them will incubate an external operational capability for al-Qaeda or a related terrorist group”  https://t.co/nooIhd4fij",en,[],[],5988062,5988062,TheEconomist,The Economist,7,17,https://twitter.com/TheEconomist/status/1558872598343290886,['https://econ.st/3bQu8wL'],[],0,,False,32,5,7,,None,,,,,,,[],,,,
246,1558872041335525378,1558872041335525378,1660499031000.0,2022-08-14 17:43:51,+0000,,The arrest of a crusading journalist in Guatemala is another milestone in the country’s seeming return to authoritarian rule  https://t.co/zmrSSLVUCl  https://t.co/kamDfjGZGm,en,[],[],5988062,5988062,TheEconomist,The Economist,7,17,https://twitter.com/TheEconomist/status/1558872041335525378,['https://econ.st/3pcpHQ7'],['https://pbs.twimg.com/media/FaI53DMXkAQY1Bt.jpg'],1,https://pbs.twimg.com/media/FaI53DMXkAQY1Bt.jpg,False,155,15,49,,None,,,,,,,[],,,,
247,1558867902681554944,1558867902681554944,1660498045000.0,2022-08-14 17:27:25,+0000,,"“The horror stories are endless. Yet Ethiopia’s government denies them,” says @berhe_lucy. In a guest essay for The Economist, she describes her struggle to write on Tigray while living in exile   https://t.co/Y84Hu8isjZ",en,[],[],5988062,5988062,TheEconomist,The Economist,7,17,https://twitter.com/TheEconomist/status/1558867902681554944,['https://econ.st/3JYxYkh'],[],0,,False,675,91,764,,None,,,,,,,[],,,,
248,1558863501321555969,1558863501321555969,1660496995000.0,2022-08-14 17:09:55,+0000,,Already the race to replace Mario Draghi’s fallen government is boiling down to one question  https://t.co/AnhNlxD8jG,en,[],[],5988062,5988062,TheEconomist,The Economist,7,17,https://twitter.com/TheEconomist/status/1558863501321555969,['https://econ.st/3PmrtIK'],[],0,,False,39,12,17,,None,,,,,,,[],,,,
249,1558858218314547200,1558858218314547200,1660495736000.0,2022-08-14 16:48:56,+0000,,"Dijon mustard is unlikely to return in normal quantities to the shelves of French supermarkets until 2023, at the earliest  https://t.co/nJBHgLCuf1",en,[],[],5988062,5988062,TheEconomist,The Economist,7,16,https://twitter.com/TheEconomist/status/1558858218314547200,['https://econ.st/3PfGH2q'],[],0,,False,84,14,32,,None,,,,,,,[],,,,
250,1558853461898412036,1558853461898412036,1660494602000.0,2022-08-14 16:30:02,+0000,,"It is easy to mock barbecue culture, at least the version on display in Memphis, for its excess and the seriousness with which it takes itself. That is a price worth paying  https://t.co/UuQRVbxrwl",en,[],[],5988062,5988062,TheEconomist,The Economist,7,16,https://twitter.com/TheEconomist/status/1558853461898412036,['https://econ.st/3djnrUb'],[],0,,False,45,4,4,,None,,,,,,,[],,,,
251,1558852966454624259,1558852966454624259,1660494483000.0,2022-08-14 16:28:03,+0000,,"“We will liberate the best scientific minds to work on the most important problems with the right support and resources,” write @ilangur and @matthewclifford in a guest essay for The Economist  https://t.co/RFhOBPtDuc",en,[],[],5988062,5988062,TheEconomist,The Economist,7,16,https://twitter.com/TheEconomist/status/1558852966454624259,['https://econ.st/3bMdIpk'],[],0,,False,31,2,9,,None,,,,,,,[],,,,
252,1558849444883439617,1558849444883439617,1660493644000.0,2022-08-14 16:14:04,+0000,,Electric vehicles seem unstoppable. Tens of millions of them will be manufactured over the next decade—which explains the frenzied activity up and down the battery value chain  https://t.co/uAYTno4UTO,en,[],[],5988062,5988062,TheEconomist,The Economist,7,16,https://twitter.com/TheEconomist/status/1558849444883439617,['https://econ.st/3QG1ugD'],[],0,,False,43,9,16,,None,,,,,,,[],,,,
253,1558846438704091137,1558846438704091137,1660492927000.0,2022-08-14 16:02:07,+0000,,The coming downturn will be shallower than those prompted by the global financial crisis and the pandemic but it bodes ill for Britain’s ability to break out of its longer-term economic rut  https://t.co/c2YkDPSyKl,en,[],[],5988062,5988062,TheEconomist,The Economist,7,16,https://twitter.com/TheEconomist/status/1558846438704091137,['https://econ.st/3bVXPMR'],[],0,,False,75,4,15,,None,,,,,,,[],,,,
254,1558841887250841603,1558841887250841603,1660491842000.0,2022-08-14 15:44:02,+0000,,"When Pakistan gained independence “the country brimmed with hope and promise”, its prime minister recalls. Now it finds itself “mired in its latest economic crisis”, he writes as part of a series of guest essays  https://t.co/dihQ2YSRKM",en,[],[],5988062,5988062,TheEconomist,The Economist,7,15,https://twitter.com/TheEconomist/status/1558841887250841603,['https://econ.st/3dr9O5y'],[],0,,False,53,13,29,,None,,,,,,,[],,,,
255,1558837494275362817,1558837494275362817,1660490795000.0,2022-08-14 15:26:35,+0000,,In the old days Muslims were quite tolerant of homosexuality  https://t.co/guTEL4KE9b,en,[],[],5988062,5988062,TheEconomist,The Economist,7,15,https://twitter.com/TheEconomist/status/1558837494275362817,['https://econ.st/3SyUBzz'],[],0,,False,324,96,77,,None,,,,,,,[],,,,
256,1558832588596416512,1558832588596416512,1660489625000.0,2022-08-14 15:07:05,+0000,,"“I have plenty of experience of dealing with bandits. After spending ten years in Russian prisons, I can say that the most dangerous thing is to show them any weakness or uncertainty,” warns Mikhail Khodorkovsky  https://t.co/IS312hqWeI",en,[],[],5988062,5988062,TheEconomist,The Economist,7,15,https://twitter.com/TheEconomist/status/1558832588596416512,['https://econ.st/3QeLClq'],[],0,,False,214,5,65,,None,,,,,,,[],,,,
257,1558831620488036352,1558831620488036352,1660489394000.0,2022-08-14 15:03:14,+0000,,"When she met her husband—the “Godfather of Ecstasy”, Alexander Shulgin—she asked if the drugs he made were safe. He told her no drug is ever safe. Nothing is. Did she really want to give it a try?  https://t.co/IuQaj8ZhtQ",en,[],[],5988062,5988062,TheEconomist,The Economist,7,15,https://twitter.com/TheEconomist/status/1558831620488036352,['https://econ.st/3BYCywJ'],[],0,,False,76,2,18,,None,,,,,,,[],,,,
258,1558824775966916609,1558824775966916609,1660487762000.0,2022-08-14 14:36:02,+0000,,It was thought that our brains get tired in the same way our muscles do: from not enough glucose to create energy. But research suggests that “depleted” brains use less than one-tenth of a Tic-Tac’s worth of additional glucose  https://t.co/zRRfTftG7g,en,[],[],5988062,5988062,TheEconomist,The Economist,7,14,https://twitter.com/TheEconomist/status/1558824775966916609,['https://econ.st/3penNOQ'],[],0,,False,108,9,32,,None,,,,,,,[],,,,
259,1558824088617078786,1558824088617078786,1660487598000.0,2022-08-14 14:33:18,+0000,,Katia and Maurice Krafft spent two decades filming pioneering footage of lava and ash. They had witnessed more than 140 eruptions on every continent except Antarctica by the time of their death in 1991  https://t.co/a7I6OgHTiq,en,[],[],5988062,5988062,TheEconomist,The Economist,7,14,https://twitter.com/TheEconomist/status/1558824088617078786,['https://econ.st/3zOC8Xb'],[],0,,False,53,11,12,,None,,,,,,,[],,,,
260,1558819019037331458,1558819019037331458,1660486390000.0,2022-08-14 14:13:10,+0000,,"Only 58% of households in Britain are charged for the volume of water they use. The rest, who pay on a fixed-price basis, use 30% more water than metered households  https://t.co/34351j2DTl",en,[],[],5988062,5988062,TheEconomist,The Economist,7,14,https://twitter.com/TheEconomist/status/1558819019037331458,['https://econ.st/3QjdXqF'],[],0,,False,70,10,14,,None,,,,,,,[],,,,
261,1558817980275884032,1558817980275884032,1660486142000.0,2022-08-14 14:09:02,+0000,,Would you work in a “sin industry”? Some people choose to—for good reasons  https://t.co/nQIKVKVy7q,en,[],[],5988062,5988062,TheEconomist,The Economist,7,14,https://twitter.com/TheEconomist/status/1558817980275884032,['https://econ.st/3drriim'],[],0,,False,41,10,12,,None,,,,,,,[],,,,
262,1558817493992574979,1558817493992574979,1660486026000.0,2022-08-14 14:07:06,+0000,,"In his new book, Ben Bernanke dispenses with many of the criticisms of low interest rates with which Edward Chancellor, the author of “The Price of Time”, is taken  https://t.co/Wa2CXiuPQA",en,[],[],5988062,5988062,TheEconomist,The Economist,7,14,https://twitter.com/TheEconomist/status/1558817493992574979,['https://econ.st/3dq9Avs'],[],0,,False,37,5,4,,None,,,,,,,[],,,,
263,1558816708558823425,1558816708558823425,1660485839000.0,2022-08-14 14:03:59,+0000,,"Frank Sinatra’s ties with organised crime are hardly a secret but “Dangerous Rhythms”, a new book, lays out those brazen connections with clarity  https://t.co/V3KHHglLw2",en,[],[],5988062,5988062,TheEconomist,The Economist,7,14,https://twitter.com/TheEconomist/status/1558816708558823425,['https://econ.st/3zRW1MV'],[],0,,False,99,4,22,,None,,,,,,,[],,,,
264,1558812694391709697,1558812694391709697,1660484882000.0,2022-08-14 13:48:02,+0000,,"For Dubai’s residents, cloud-seeding has become something of a running joke. A day at the beach ruined by a freak storm is not simply bad luck—it might merit a complaint to the government  https://t.co/Q82LJEWDoc",en,[],[],5988062,5988062,TheEconomist,The Economist,7,13,https://twitter.com/TheEconomist/status/1558812694391709697,['https://econ.st/3zMLzGx'],[],0,,False,61,6,20,,None,,,,,,,[],,,,
265,1558811414269140995,1558811414269140995,1660484577000.0,2022-08-14 13:42:57,+0000,,"The country remains, for both foreigners and Indians, an astonishingly complex place, one that nobody could ever claim to fully comprehend. Try this selection of books as a primer  https://t.co/8AysOY1LzE",en,[],[],5988062,5988062,TheEconomist,The Economist,7,13,https://twitter.com/TheEconomist/status/1558811414269140995,['https://econ.st/3QpKT0I'],[],0,,False,43,7,11,,None,,,,,,,[],,,,
266,1558807515634503686,1558807515634503686,1660483647000.0,2022-08-14 13:27:27,+0000,,Disney’s fifth feature-­length cartoon—ostensibly about a deer gambolling around an idyllic forest—is far bolder than its fluffy reputation might suggest  https://t.co/5j45EkzKGo,en,[],[],5988062,5988062,TheEconomist,The Economist,7,13,https://twitter.com/TheEconomist/status/1558807515634503686,['https://econ.st/3zVrCxc'],[],0,,False,60,7,10,,None,,,,,,,[],,,,
267,1558802388684836864,1558802388684836864,1660482425000.0,2022-08-14 13:07:05,+0000,,"Mind-stretching insights on global issues with independent, in-depth analysis and opinion  https://t.co/sGTjFtRAuB  https://t.co/WYpbahh8jr",en,[],[],5988062,5988062,TheEconomist,The Economist,7,13,https://twitter.com/TheEconomist/status/1558802388684836864,['https://econ.st/3JRzJ2q'],['https://pbs.twimg.com/media/FaH6gwtWAAIZ66A.jpg'],1,https://pbs.twimg.com/media/FaH6gwtWAAIZ66A.jpg,False,17,6,1,,None,,,,,,,[],,,,
268,1558799120449560577,1558799120449560577,1660481646000.0,2022-08-14 12:54:06,+0000,,"What does it mean to win a war today? On “The Economist Asks” podcast, @annemcelvoy talks to national-security expert Philip Bobbitt about how to measure victory in conflicts from Afghanistan to Ukraine  https://t.co/B27mt7ADyB",en,[],[],5988062,5988062,TheEconomist,The Economist,7,12,https://twitter.com/TheEconomist/status/1558799120449560577,['https://econ.st/3QU4cPV'],[],0,,False,27,5,11,,None,,,,,,,[],,,,
269,1558796601182797824,1558796601182797824,1660481045000.0,2022-08-14 12:44:05,+0000,,"“With unity and discipline, Pakistan at 100 promises to be a vastly different country.” As Pakistan marks 75 years of independence, Shehbaz Sharif sets out his vision for the country, as part of a series of guest essays  https://t.co/kE9hO2BIzB",en,[],[],5988062,5988062,TheEconomist,The Economist,7,12,https://twitter.com/TheEconomist/status/1558796601182797824,['https://econ.st/3SSZrrl'],[],0,,False,41,24,14,,None,,,,,,,[],,,,
270,1558796108201168896,1558796108201168896,1660480927000.0,2022-08-14 12:42:07,+0000,,Proponents of stop-and-search say it removes weapons from the streets. But more than two-thirds of stops in the year to March 2021 were because of drugs  https://t.co/MSDfdksvYv,en,[],[],5988062,5988062,TheEconomist,The Economist,7,12,https://twitter.com/TheEconomist/status/1558796108201168896,['https://econ.st/3bQ6dNS'],[],0,,False,39,9,16,,None,,,,,,,[],,,,
271,1558792070051004416,1558792070051004416,1660479965000.0,2022-08-14 12:26:05,+0000,,"“Other Names for Love” revolves around a teenage boy’s pivotal relationships with strikingly different men. It is an elegant, entrancing novel  https://t.co/4WzOTesW0B",en,[],[],5988062,5988062,TheEconomist,The Economist,7,12,https://twitter.com/TheEconomist/status/1558792070051004416,['https://econ.st/3SLoBIw'],[],0,,False,21,3,4,,None,,,,,,,[],,,,
272,1558788254173986817,1558788254173986817,1660479055000.0,2022-08-14 12:10:55,+0000,,"Unlike software firms, biotech companies need constant injections of capital to develop their drugs, which takes lots of time and money  https://t.co/opKTop3Mt7",en,[],[],5988062,5988062,TheEconomist,The Economist,7,12,https://twitter.com/TheEconomist/status/1558788254173986817,['https://econ.st/3pdwcC3'],[],0,,False,60,7,19,,None,,,,,,,[],,,,
273,1558784358022004736,1558784358022004736,1660478126000.0,2022-08-14 11:55:26,+0000,,Food and fuel prices have risen 50% in a year. Only one in 20 families have enough to eat. But those who once lived on the front lines are safer than they have been in some time  https://t.co/AW82KQM3pr,en,[],[],5988062,5988062,TheEconomist,The Economist,7,11,https://twitter.com/TheEconomist/status/1558784358022004736,['https://econ.st/3SIk0qu'],[],0,,False,44,10,14,,None,,,,,,,[],,,,
274,1558779729578270720,1558779729578270720,1660477022000.0,2022-08-14 11:37:02,+0000,,"The share of youngsters who are “almost constantly” online has roughly doubled, a survey by the Pew Research Centre finds   https://t.co/VR4nOQABdf",en,[],[],5988062,5988062,TheEconomist,The Economist,7,11,https://twitter.com/TheEconomist/status/1558779729578270720,['https://econ.st/3STboh1'],[],0,,False,82,9,39,,None,,,,,,,[],,,,
275,1558775865898680321,1558775865898680321,1660476101000.0,2022-08-14 11:21:41,+0000,,The true lesson of the comparison is that neither side ought to be satisfied: Europeans should be unhappy with their lower incomes; Americans really should be getting a lot more from their riches   https://t.co/CohzZXXMDi,en,[],[],5988062,5988062,TheEconomist,The Economist,7,11,https://twitter.com/TheEconomist/status/1558775865898680321,['https://econ.st/3JOg57o'],[],0,,False,44,3,10,,None,,,,,,,[],,,,
276,1558771688153686016,1558771688153686016,1660475105000.0,2022-08-14 11:05:05,+0000,,"Those who oppose singular data argue that the word refers to a set of numbers. Yet the properties of the thing itself are not a reliable guide to a term’s grammar—“rice” is singular, for example  https://t.co/aoe3ewiW9x",en,[],[],5988062,5988062,TheEconomist,The Economist,7,11,https://twitter.com/TheEconomist/status/1558771688153686016,['https://econ.st/3QquYiP'],[],0,,False,32,11,6,,None,,,,,,,[],,,,
277,1558770924836487168,1558770924836487168,1660474923000.0,2022-08-14 11:02:03,+0000,,These issues continue to unsettle Minnesotan politics more than two years after George Floyd’s murder  https://t.co/9mro5ZDvhM,en,[],[],5988062,5988062,TheEconomist,The Economist,7,11,https://twitter.com/TheEconomist/status/1558770924836487168,['https://econ.st/3QFOaJe'],[],0,,False,26,10,6,,None,,,,,,,[],,,,
278,1558768390923497472,1558768390923497472,1660474319000.0,2022-08-14 10:51:59,+0000,,"Despite their manifold differences, all three countries view nukes as “political instruments” rather than “usable tools of war”, argues Ashley Tellis of the Carnegie Endowment, a think-tank in Washington  https://t.co/HzRDMihyHR",en,[],[],5988062,5988062,TheEconomist,The Economist,7,10,https://twitter.com/TheEconomist/status/1558768390923497472,['https://econ.st/3pbJwqG'],[],0,,False,30,7,7,,None,,,,,,,[],,,,
279,1558763573534408704,1558763573534408704,1660473171000.0,2022-08-14 10:32:51,+0000,,"A new paper argues that the planet’s transformation was not triggered by forces from within, but from outer space  https://t.co/Cs7XgXU4uK",en,[],[],5988062,5988062,TheEconomist,The Economist,7,10,https://twitter.com/TheEconomist/status/1558763573534408704,['https://econ.st/3AdH5dg'],[],0,,False,56,9,11,,None,,,,,,,[],,,,
280,1558759566719991810,1558759566719991810,1660472215000.0,2022-08-14 10:16:55,+0000,,Locals in the “people’s republics” of Donetsk and Luhansk are using social media to share information that can help men aged 18-55 avoid Russian army recruiters  https://t.co/JnrvE0lu4E,en,[],[],5988062,5988062,TheEconomist,The Economist,7,10,https://twitter.com/TheEconomist/status/1558759566719991810,['https://econ.st/3pd6TjF'],[],0,,False,64,9,19,,None,,,,,,,[],,,,
281,1558755610212159491,1558755610212159491,1660471272000.0,2022-08-14 10:01:12,+0000,,Thinking like an economist comprises of two main atributes   https://t.co/uS1pa6AYWf,en,[],[],5988062,5988062,TheEconomist,The Economist,7,10,https://twitter.com/TheEconomist/status/1558755610212159491,['https://econ.st/3Qbdeb4'],[],0,,False,50,8,11,,None,,,,,,,[],,,,
282,1558751364800565251,1558751364800565251,1660470260000.0,2022-08-14 09:44:20,+0000,,"The 75th anniversary of Pakistan’s independence is “a moment that merits serious introspection”, the country’s prime minister writes as part of a series of guest essays  https://t.co/x5JM8A2sG1",en,[],[],5988062,5988062,TheEconomist,The Economist,7,09,https://twitter.com/TheEconomist/status/1558751364800565251,['https://econ.st/3QGUkZE'],[],0,,False,37,7,9,,None,,,,,,,[],,,,
