,id,conversation_id,created_at,date,timezone,place,tweet,language,hashtags,cashtags,user_id,user_id_str,username,name,day,hour,link,urls,photos,video,thumbnail,retweet,nlikes,nreplies,nretweets,quote_url,search,near,geo,source,user_rt_id,user_rt,retweet_id,reply_to,retweet_date,translate,trans_src,trans_dest
567,1557665506701807618,1557665506701807618,1660211371000.0,2022-08-11 09:49:31,+0000,,"Between 1999 and 2020 the epidemic killed over half a million Americans. “American Cartel”, a new book, chronicles the tragic, man-made epidemic  https://t.co/mRkU8sBlAA",en,[],[],5988062,5988062,TheEconomist,The Economist,4,09,https://twitter.com/TheEconomist/status/1557665506701807618,['https://econ.st/3Q8urSF'],[],0,,False,56,7,16,,None,,,,,,,[],,,,
568,1557660475923566592,1557660475923566592,1660210172000.0,2022-08-11 09:29:32,+0000,,The World Health Organisation hopes efforts to curb the virus will intensify now it has declared a global emergency  https://t.co/lS84hQ5x94  https://t.co/oy0YUP3s7P,en,[],[],5988062,5988062,TheEconomist,The Economist,4,09,https://twitter.com/TheEconomist/status/1557660475923566592,['https://econ.st/3QoRyYI'],['https://pbs.twimg.com/media/FZ3r8rzX0AAMYe3.jpg'],1,https://pbs.twimg.com/media/FZ3r8rzX0AAMYe3.jpg,False,78,12,44,,None,,,,,,,[],,,,
569,1557659081585967105,1557659081585967105,1660209839000.0,2022-08-11 09:23:59,+0000,,"♦️ Stockmarkets rally as American inflation eases slightly.  ♦️ Donald Trump refuses to answer questions under oath, invoking his Fifth Amendment against self-incrimination.  ♦️ Ukraine’s allies gather in Copenhagen to discuss military defences.  Catch up on today’s news ⬇️",en,[],[],5988062,5988062,TheEconomist,The Economist,4,09,https://twitter.com/TheEconomist/status/1557659081585967105,[],[],0,,False,27,0,7,,None,,,,,,,[],,,,
570,1557655480545181696,1557655480545181696,1660208981000.0,2022-08-11 09:09:41,+0000,,"For more than two decades, attempts to turn Neil Gaiman’s epic comic-book series into a film failed. But Netflix’s new adaptation of “The Sandman” is magnificent   https://t.co/nW5ZmzCuAQ",en,[],[],5988062,5988062,TheEconomist,The Economist,4,09,https://twitter.com/TheEconomist/status/1557655480545181696,['https://econ.st/3JIejEJ'],[],0,,False,68,5,11,,None,,,,,,,[],,,,
571,1557650633708261376,1557650633708261376,1660207825000.0,2022-08-11 08:50:25,+0000,,"The headaches of the past year from worker shortages, far from being temporary, will be a recurrent problem in an ageing America that has forgotten how immigrants made the country what it is  https://t.co/osKXkvQ74k",en,[],[],5988062,5988062,TheEconomist,The Economist,4,08,https://twitter.com/TheEconomist/status/1557650633708261376,['https://econ.st/3vJHiCj'],[],0,,False,70,8,18,,None,,,,,,,[],,,,
572,1557645727794331649,1557645727794331649,1660206655000.0,2022-08-11 08:30:55,+0000,,"Just by keeping the show on the road, stop-gap administrations serve an important purpose. But constitutional restrictions usually prevent them from legislating  https://t.co/GsonfCnmy9",en,[],[],5988062,5988062,TheEconomist,The Economist,4,08,https://twitter.com/TheEconomist/status/1557645727794331649,['https://econ.st/3AcEyjH'],[],0,,False,27,0,6,,None,,,,,,,[],,,,
573,1557640711931142144,1557640711931142144,1660205459000.0,2022-08-11 08:10:59,+0000,,The sun is both our creator and destroyer  https://t.co/6zcYOkjWOn,en,[],[],5988062,5988062,TheEconomist,The Economist,4,08,https://twitter.com/TheEconomist/status/1557640711931142144,['https://econ.st/3bHG7gc'],[],0,,False,108,10,24,,None,,,,,,,[],,,,
574,1557635872857669632,1557635872857669632,1660204306000.0,2022-08-11 07:51:46,+0000,,"For the middle-aged and old, an inescapable comparison to the present day is with the summer of 1976. That should be a warning  https://t.co/23neHrYnEM",en,[],[],5988062,5988062,TheEconomist,The Economist,4,07,https://twitter.com/TheEconomist/status/1557635872857669632,['https://econ.st/3paeqzK'],[],0,,False,47,5,16,,None,,,,,,,[],,,,
575,1557631674980122626,1557631674980122626,1660203305000.0,2022-08-11 07:35:05,+0000,,"Israel’s new prime minister, Yair Lapid, is facing a tough battle for re-election on November 1st. Unlike the two other main candidates he lacks a military record and experience of leading his country in war  https://t.co/JHiLuB3fzQ",en,[],[],5988062,5988062,TheEconomist,The Economist,4,07,https://twitter.com/TheEconomist/status/1557631674980122626,['https://econ.st/3A36cPT'],[],0,,False,25,8,9,,None,,,,,,,[],,,,
576,1557626736669507584,1557626736669507584,1660202127000.0,2022-08-11 07:15:27,+0000,,And why foreign policy should pay more heed to half of humanity  https://t.co/4d9AIZAhUM,en,[],[],5988062,5988062,TheEconomist,The Economist,4,07,https://twitter.com/TheEconomist/status/1557626736669507584,['https://econ.st/3BNDN1G'],[],0,,False,79,10,36,,None,,,,,,,[],,,,
577,1557621828922884096,1557621828922884096,1660200957000.0,2022-08-11 06:55:57,+0000,,"Ukraine, despite a smaller population, has a larger supply of eager recruits. Ukraine is also receiving ever more sophisticated Western weaponry as Russia cannibalises its own forces   https://t.co/1609GU36yb",en,[],[],5988062,5988062,TheEconomist,The Economist,4,06,https://twitter.com/TheEconomist/status/1557621828922884096,['https://econ.st/3QzMNLU'],[],0,,False,71,16,30,,None,,,,,,,[],,,,
578,1557616872991997953,1557616872991997953,1660199776000.0,2022-08-11 06:36:16,+0000,,A new generation of leaders would energise not just the House Democrats but the party  https://t.co/H6zFPGsh7E,en,[],[],5988062,5988062,TheEconomist,The Economist,4,06,https://twitter.com/TheEconomist/status/1557616872991997953,['https://econ.st/3SzFC8A'],[],0,,False,83,13,14,,None,,,,,,,[],,,,
579,1557612017715920896,1557612017715920896,1660198618000.0,2022-08-11 06:16:58,+0000,,The enemy of democracy is complacency   https://t.co/McqZS42KRe,en,[],[],5988062,5988062,TheEconomist,The Economist,4,06,https://twitter.com/TheEconomist/status/1557612017715920896,['https://econ.st/3A85jWl'],[],0,,False,125,26,45,,None,,,,,,,[],,,,
580,1557606991740243968,1557606991740243968,1660197420000.0,2022-08-11 05:57:00,+0000,,"In Dijon, the capital of Burgundy and home to the mustard that bears its name, the craft of the moutardier dates back to 1634. Yet even in this town, pots of the stuff are near-impossible to find  https://t.co/XjrwIcQhBm",en,[],[],5988062,5988062,TheEconomist,The Economist,4,05,https://twitter.com/TheEconomist/status/1557606991740243968,['https://econ.st/3SDoiiN'],[],0,,False,62,4,25,,None,,,,,,,[],,,,
581,1557601521180835841,1557601521180835841,1660196116000.0,2022-08-11 05:35:16,+0000,,"“In some ways, the best bet for emerging markets might be a recession in the US,” @economistmeg tells @birdyword on this week’s “Money Talks”  https://t.co/BO4ZJcLTK6",en,[],[],5988062,5988062,TheEconomist,The Economist,4,05,https://twitter.com/TheEconomist/status/1557601521180835841,['https://econ.st/3QhtmYu'],[],0,,False,21,5,10,,None,,,,,,,[],,,,
582,1557594199725326336,1557594199725326336,1660194370000.0,2022-08-11 05:06:10,+0000,,"“China’s armed forces are comparable to America’s in quality and quantity,” writes the military expert. “But even with all these improvements it is unclear whether China could take Taiwan by force”  https://t.co/CqGpXNMeQw",en,[],[],5988062,5988062,TheEconomist,The Economist,4,05,https://twitter.com/TheEconomist/status/1557594199725326336,['https://econ.st/3bK0CJ7'],[],0,,False,54,22,21,,None,,,,,,,[],,,,
583,1557589647429181443,1557589647429181443,1660193285000.0,2022-08-11 04:48:05,+0000,,"Ukraine’s health ministry predicts that the war will leave 3m-4m people in need of pharmacological interventions, and another 15m requiring psychological support  https://t.co/piLZj4MixO",en,[],[],5988062,5988062,TheEconomist,The Economist,4,04,https://twitter.com/TheEconomist/status/1557589647429181443,['https://econ.st/3oYy2GX'],[],0,,False,79,8,27,,None,,,,,,,[],,,,
584,1557572408340467712,1557572408340467712,1660189175000.0,2022-08-11 03:39:35,+0000,,"To many Indians and in particular to the country’s 200m Muslims, the world’s biggest religious minority, the government’s shrug of indifference to growing distress is deeply ominous  https://t.co/Fqo3XZqAcQ",en,[],[],5988062,5988062,TheEconomist,The Economist,4,03,https://twitter.com/TheEconomist/status/1557572408340467712,['https://econ.st/3bKcNFC'],[],0,,False,64,18,23,,None,,,,,,,[],,,,
585,1557567281999265795,1557567281999265795,1660187952000.0,2022-08-11 03:19:12,+0000,,"“When you start out with a mystery, you cast the net wide.” @DrToniHo tells @kncukier how she investigated what’s causing the outbreak of child hepatitis. Listen to “Babbage”  https://t.co/AiteFlJW9w",en,[],[],5988062,5988062,TheEconomist,The Economist,4,03,https://twitter.com/TheEconomist/status/1557567281999265795,['https://econ.st/3zGsrtP'],[],0,,False,24,7,14,,None,,,,,,,[],,,,
586,1557562193452859393,1557562193452859393,1660186739000.0,2022-08-11 02:58:59,+0000,,"Four books and a film, recommended by our Schumpeter columnist  https://t.co/CfMEIR8HW5",en,[],[],5988062,5988062,TheEconomist,The Economist,4,02,https://twitter.com/TheEconomist/status/1557562193452859393,['https://econ.st/3Pg9eVG'],[],0,,False,30,2,7,,None,,,,,,,[],,,,
587,1557556975281606663,1557556975281606663,1660185495000.0,2022-08-11 02:38:15,+0000,,Is Taiwan prepared to fend off an invasion by China? American and Taiwanese strategists hope that adopting a “porcupine” defence strategy would help it do so. We explain why   https://t.co/2uMvdpXzQa,en,[],[],5988062,5988062,TheEconomist,The Economist,4,02,https://twitter.com/TheEconomist/status/1557556975281606663,['https://econ.st/3vJ9dT9'],[],0,,False,79,11,28,,None,,,,,,,[],,,,
588,1557549822839750656,1557549822839750656,1660183790000.0,2022-08-11 02:09:50,+0000,,Donald Trump gave militias the impression that someone sympathetic to their beliefs was finally in power. The insurrection on January 6th was a last-ditch attempt to keep him there  https://t.co/vj5D8V4jiR,en,[],[],5988062,5988062,TheEconomist,The Economist,4,02,https://twitter.com/TheEconomist/status/1557549822839750656,['https://econ.st/3bITMmW'],[],0,,False,96,50,31,,None,,,,,,,[],,,,
589,1557545273030856709,1557545273030856709,1660182705000.0,2022-08-11 01:51:45,+0000,,"The biggest cause of China’s stubbornness on covid is President Xi Jinping, who has made pandemic controls into a political campaign and loyalty test  https://t.co/4dl3AZxdWn",en,[],[],5988062,5988062,TheEconomist,The Economist,4,01,https://twitter.com/TheEconomist/status/1557545273030856709,['https://econ.st/3Qx8CMm'],[],0,,False,63,12,25,,None,,,,,,,[],,,,
590,1557540277728022529,1557540277728022529,1660181514000.0,2022-08-11 01:31:54,+0000,,Our senior economics writer has picked out five books that will get you to see the world like an economist  https://t.co/RsrS99X5Pb,en,[],[],5988062,5988062,TheEconomist,The Economist,4,01,https://twitter.com/TheEconomist/status/1557540277728022529,['https://econ.st/3SRpmQq'],[],0,,False,105,10,24,,None,,,,,,,[],,,,
591,1557534875850268672,1557534875850268672,1660180226000.0,2022-08-11 01:10:26,+0000,,"Believing the system is designed to keep them poor, some prisoners in America are investing in stocks and shares to break a vicious cycle of financial illiteracy and incarceration. From 1843 magazine  https://t.co/9yumJ78qaw",en,[],[],5988062,5988062,TheEconomist,The Economist,4,01,https://twitter.com/TheEconomist/status/1557534875850268672,['https://econ.st/3OSWYu1'],[],0,,False,80,6,32,,None,,,,,,,[],,,,
592,1557529868983844864,1557529868983844864,1660179032000.0,2022-08-11 00:50:32,+0000,,"Up to 300,000 people are estimated to have left the country since the start of the war in Ukraine. This will have profound effects in the long run  https://t.co/rHDJAMNnEV",en,[],[],5988062,5988062,TheEconomist,The Economist,4,00,https://twitter.com/TheEconomist/status/1557529868983844864,['https://econ.st/3QvY3ZY'],[],0,,False,76,8,24,,None,,,,,,,[],,,,
593,1557525077134041088,1557525077134041088,1660177890000.0,2022-08-11 00:31:30,+0000,,It amounts to the largest package of climate spending in American history  https://t.co/Z0d61J0EOp,en,[],[],5988062,5988062,TheEconomist,The Economist,4,00,https://twitter.com/TheEconomist/status/1557525077134041088,['https://econ.st/3bHnj0n'],[],0,,False,83,13,21,,None,,,,,,,[],,,,
594,1557520153272848384,1557520153272848384,1660176716000.0,2022-08-11 00:11:56,+0000,,Many tycoons have greatly added to their personal wealth with direct help from local authorities  https://t.co/lswn0MAh3B,en,[],[],5988062,5988062,TheEconomist,The Economist,4,00,https://twitter.com/TheEconomist/status/1557520153272848384,['https://econ.st/3JzPif0'],[],0,,False,51,6,12,,None,,,,,,,[],,,,
595,1557514684508639232,1557514684508639232,1660175412000.0,2022-08-10 23:50:12,+0000,,Donald Trump’s power to warp reality is so great that this act of integrity against him may actually help him wreck the republic  https://t.co/KNYiS8bZPw,en,[],[],5988062,5988062,TheEconomist,The Economist,3,23,https://twitter.com/TheEconomist/status/1557514684508639232,['https://econ.st/3QEcD1z'],[],0,,False,91,53,27,,None,,,,,,,[],,,,
596,1557509018037506049,1557509018037506049,1660174061000.0,2022-08-10 23:27:41,+0000,,"Republicans might interpret the events as a sign the Department of Justice has abandoned its discretion. But Merrick Garland, the attorney-general, is not one for taking bold steps on a whim  https://t.co/pQaLKnw0a5",en,[],[],5988062,5988062,TheEconomist,The Economist,3,23,https://twitter.com/TheEconomist/status/1557509018037506049,['https://econ.st/3bJ9COs'],[],0,,False,56,19,15,,None,,,,,,,[],,,,
597,1557503393500958721,1557503393500958721,1660172720000.0,2022-08-10 23:05:20,+0000,,"There are better, fairer and cheaper ways than meddling with prices  https://t.co/1CZomhp2eJ",en,[],[],5988062,5988062,TheEconomist,The Economist,3,23,https://twitter.com/TheEconomist/status/1557503393500958721,['https://econ.st/3djb76w'],[],0,,False,38,7,13,,None,,,,,,,[],,,,
598,1557497832231297024,1557497832231297024,1660171394000.0,2022-08-10 22:43:14,+0000,,Their powers vary—and some perform virtually all the duties of permanent ones  https://t.co/aq7VKbVllc,en,[],[],5988062,5988062,TheEconomist,The Economist,3,22,https://twitter.com/TheEconomist/status/1557497832231297024,['https://econ.st/3zJ4XUV'],[],0,,False,22,2,9,,None,,,,,,,[],,,,
599,1557492402524459009,1557492402524459009,1660170100000.0,2022-08-10 22:21:40,+0000,,Ukraine’s ability to export its harvests should play a huge role in alleviating the grain shortage that is affecting some of the world’s poorest countries. It should also help bring prices down  https://t.co/GFjNRP1gh9,en,[],[],5988062,5988062,TheEconomist,The Economist,3,22,https://twitter.com/TheEconomist/status/1557492402524459009,['https://econ.st/3Qs12Cr'],[],0,,False,76,2,27,,None,,,,,,,[],,,,
600,1557486754768338944,1557486754768338944,1660168753000.0,2022-08-10 21:59:13,+0000,,"Xi Jinping “wants progress on the Taiwan issue, and domestically talk in the press is shifting from peaceful reunification to armed reunification”, says military expert @osmastro  https://t.co/e2qSnEEefz",en,[],[],5988062,5988062,TheEconomist,The Economist,3,21,https://twitter.com/TheEconomist/status/1557486754768338944,['https://econ.st/3PjqkSi'],[],0,,False,31,15,18,,None,,,,,,,[],,,,
601,1557481224196743175,1557481224196743175,1660167435000.0,2022-08-10 21:37:15,+0000,,Which emerging-market countries are looking particularly vulnerable? Find out on this week’s “Money Talks” podcast  https://t.co/dEq2qtDrTx,en,[],[],5988062,5988062,TheEconomist,The Economist,3,21,https://twitter.com/TheEconomist/status/1557481224196743175,['https://econ.st/3P8ffna'],[],0,,False,24,2,8,,None,,,,,,,[],,,,
602,1557474466900463617,1557474466900463617,1660165824000.0,2022-08-10 21:10:24,+0000,,"“Prisoners, just like normies on the outside, gambled on faddish coins.” Two inmates at a US prison describe how pandemic stimulus cheques created an investing frenzy behind bars. From 1843 magazine  https://t.co/fPncVa6ZYx",en,[],[],5988062,5988062,TheEconomist,The Economist,3,21,https://twitter.com/TheEconomist/status/1557474466900463617,['https://econ.st/3Jtsdui'],[],0,,False,27,2,8,,None,,,,,,,[],,,,
603,1557469212888731649,1557469212888731649,1660164571000.0,2022-08-10 20:49:31,+0000,,"The campaign for Pennsylvania’s open Senate seat “seems to have been mainly waged online through snarky memes.” @jonfasman digs into this unusual race, on our “Checks and Balance” podcast  https://t.co/5lxLAkwdwR",en,[],[],5988062,5988062,TheEconomist,The Economist,3,20,https://twitter.com/TheEconomist/status/1557469212888731649,['https://econ.st/3Q5cZyd'],[],0,,False,15,3,5,,None,,,,,,,[],,,,
604,1557458720350785537,1557458720350785537,1660162069000.0,2022-08-10 20:07:49,+0000,,“Liberals and conservatives are clinging to caricatures of the other side.”  @AdamMGrant tells our podcast “The Economist Asks” why political polarisation makes people worse at arguing  https://t.co/qyjfUDBR0k,en,[],[],5988062,5988062,TheEconomist,The Economist,3,20,https://twitter.com/TheEconomist/status/1557458720350785537,['https://econ.st/3btrHQu'],[],0,,False,64,13,20,,None,,,,,,,[],,,,
605,1557453653363101696,1557453653363101696,1660160861000.0,2022-08-10 19:47:41,+0000,,"Economics has a reputation as a dry, heartless subject, full of boring equations. The reality is much more interesting  https://t.co/cO4Af7ycEG",en,[],[],5988062,5988062,TheEconomist,The Economist,3,19,https://twitter.com/TheEconomist/status/1557453653363101696,['https://econ.st/3psMasl'],[],0,,False,88,3,28,,None,,,,,,,[],,,,
606,1557448943117783040,1557448943117783040,1660159738000.0,2022-08-10 19:28:58,+0000,,Can you design interactive charts? We are looking for an early-career interactive visual journalist   https://t.co/VJLejZOufV,en,[],[],5988062,5988062,TheEconomist,The Economist,3,19,https://twitter.com/TheEconomist/status/1557448943117783040,['https://econ.st/3PIUhw8'],[],0,,False,27,1,13,,None,,,,,,,[],,,,
607,1557444210877661184,1557444210877661184,1660158610000.0,2022-08-10 19:10:10,+0000,,Parts of the state are barely functioning. It is Britain’s summer of discontent—and a worse winter and spring could follow  https://t.co/VKoUr79JHT  https://t.co/QXOf4qGjEo,en,[],[],5988062,5988062,TheEconomist,The Economist,3,19,https://twitter.com/TheEconomist/status/1557444210877661184,['https://econ.st/3djTjbo'],['https://pbs.twimg.com/media/FZ0nQVQXwAI8vsh.jpg'],1,https://pbs.twimg.com/media/FZ0nQVQXwAI8vsh.jpg,False,56,6,33,,None,,,,,,,[],,,,
608,1557439527077249024,1557439527077249024,1660157493000.0,2022-08-10 18:51:33,+0000,,It is too early to know the full extent of Ukraine’s collective trauma. Vladimir Putin has dropped a delayed-action bomb on the psyche of every Ukrainian  https://t.co/mZtg4rnbNP,en,[],[],5988062,5988062,TheEconomist,The Economist,3,18,https://twitter.com/TheEconomist/status/1557439527077249024,['https://econ.st/3vNIzIF'],[],0,,False,74,12,22,,None,,,,,,,[],,,,
609,1557434958146420745,1557434958146420745,1660156404000.0,2022-08-10 18:33:24,+0000,,Interim governments keep the seats around the cabinet table warm until a new government is formed. But what can these stop-gap executives actually achieve? We explain  https://t.co/WvjOiU6S7v,en,[],[],5988062,5988062,TheEconomist,The Economist,3,18,https://twitter.com/TheEconomist/status/1557434958146420745,['https://econ.st/3dmCr3G'],[],0,,False,28,4,7,,None,,,,,,,[],,,,
610,1557429480594997248,1557429480594997248,1660155098000.0,2022-08-10 18:11:38,+0000,,The raid on Mar-a-Lago may have been necessary to serve justice. A prosecution may eventually prove necessary as well. The hope is that the rule of law has weight enough to survive the contest  https://t.co/TSLnVF27yd,en,[],[],5988062,5988062,TheEconomist,The Economist,3,18,https://twitter.com/TheEconomist/status/1557429480594997248,['https://econ.st/3bOAkFG'],[],0,,False,88,18,23,,None,,,,,,,[],,,,
611,1557424304563884032,1557424304563884032,1660153864000.0,2022-08-10 17:51:04,+0000,,"Gen Z happily fritters ever more time online and are fast deserting once-popular platforms, a new survey reveals   https://t.co/XQV38u5oLQ",en,[],[],5988062,5988062,TheEconomist,The Economist,3,17,https://twitter.com/TheEconomist/status/1557424304563884032,['https://econ.st/3zMX8gP'],[],0,,False,82,9,24,,None,,,,,,,[],,,,
612,1557418774709551104,1557418774709551104,1660152545000.0,2022-08-10 17:29:05,+0000,,"The sharp pale-yellow condiment, a French household staple, has all but disappeared from the country’s supermarket shelves  https://t.co/dtMxQXhBW8",en,[],[],5988062,5988062,TheEconomist,The Economist,3,17,https://twitter.com/TheEconomist/status/1557418774709551104,['https://econ.st/3QrJZAM'],[],0,,False,41,8,15,,None,,,,,,,[],,,,
613,1557414212577673216,1557414212577673216,1660151458000.0,2022-08-10 17:10:58,+0000,,"In the second part of our “Money Talks” series on the strong dollar, @SoumayaKeynes, @birdyword and @alice_fulwood look at the impact it is having on emerging markets  https://t.co/TlZaQTdkKY",en,[],[],5988062,5988062,TheEconomist,The Economist,3,17,https://twitter.com/TheEconomist/status/1557414212577673216,['https://econ.st/3SIeIeI'],[],0,,False,18,1,8,,None,,,,,,,[],,,,
614,1557408977046183937,1557408977046183937,1660150210000.0,2022-08-10 16:50:10,+0000,,"This summer in Britain has been a season of drift and dysfunction. Dry weather has combined with inflation, industrial disputes, transport snafus and political paralysis  https://t.co/I1KuK4OkCW",en,[],[],5988062,5988062,TheEconomist,The Economist,3,16,https://twitter.com/TheEconomist/status/1557408977046183937,['https://econ.st/3zOqJ9x'],[],0,,False,57,7,15,,None,,,,,,,[],,,,
615,1557404049372332032,1557404049372332032,1660149035000.0,2022-08-10 16:30:35,+0000,,"This might suggest Ghana has made a dog’s dinner of managing its economy. Yet its people are the richest in west Africa, measured by GDP per person  https://t.co/BYkUQCNoMx",en,[],[],5988062,5988062,TheEconomist,The Economist,3,16,https://twitter.com/TheEconomist/status/1557404049372332032,['https://econ.st/3QgOZru'],[],0,,False,39,12,19,,None,,,,,,,[],,,,
616,1557399241722576900,1557399241722576900,1660147888000.0,2022-08-10 16:11:28,+0000,,"Once signed into law, the act will shower $369bn of subsidies and tax credits on everything from renewable energy and electric vehicles to hydrogen hubs and carbon capture and sequestration  https://t.co/JyUU3flYHn",en,[],[],5988062,5988062,TheEconomist,The Economist,3,16,https://twitter.com/TheEconomist/status/1557399241722576900,['https://econ.st/3BVTQe2'],[],0,,False,88,16,22,,None,,,,,,,[],,,,
617,1557394086306406402,1557394086306406402,1660146659000.0,2022-08-10 15:50:59,+0000,,"A popular hypothesis links the spike in child hepatitis cases to covid-19 lockdowns. @kncukier tries to unravel the mystery, on “Babbage”  https://t.co/2b3cfU2xJc",en,[],[],5988062,5988062,TheEconomist,The Economist,3,15,https://twitter.com/TheEconomist/status/1557394086306406402,['https://econ.st/3p5BK1g'],[],0,,False,29,5,11,,None,,,,,,,[],,,,
618,1557389080106655744,1557389080106655744,1660145466000.0,2022-08-10 15:31:06,+0000,,"Few would begrudge the queen more rest. They may feel more ambivalent about her stand-in, Prince Charles  https://t.co/0HkuekbBue  https://t.co/naxs36fQyb",en,[],[],5988062,5988062,TheEconomist,The Economist,3,15,https://twitter.com/TheEconomist/status/1557389080106655744,['https://econ.st/3QA9j7H'],['https://pbs.twimg.com/media/FZz1HMNXoAAg1Fg.jpg'],1,https://pbs.twimg.com/media/FZz1HMNXoAAg1Fg.jpg,False,64,8,11,,None,,,,,,,[],,,,
619,1557384326135824395,1557384326135824395,1660144332000.0,2022-08-10 15:12:12,+0000,,"“There’s a lot of vibes-based politics in voting, and appearing to be normal matters a lot.”  @imkahloon says voters like candidates who they can relate to, which could help Democrat John Fetterman in Pennsylvania. Listen to “Checks and Balance”  https://t.co/957eH1tjvY",en,[],[],5988062,5988062,TheEconomist,The Economist,3,15,https://twitter.com/TheEconomist/status/1557384326135824395,['https://econ.st/3vHqLiw'],[],0,,False,18,4,4,,None,,,,,,,[],,,,
620,1557379727194734593,1557379727194734593,1660143236000.0,2022-08-10 14:53:56,+0000,,Britain is far from entering a new regency period—but might be becoming a shadow regency instead  https://t.co/p86DzYm6Dq,en,[],[],5988062,5988062,TheEconomist,The Economist,3,14,https://twitter.com/TheEconomist/status/1557379727194734593,['https://econ.st/3dchqcb'],[],0,,False,42,7,15,,None,,,,,,,[],,,,
621,1557374263962882048,1557374263962882048,1660141933000.0,2022-08-10 14:32:13,+0000,,Filtration was used in the aftermath of the second world war and during the Chechen wars of the 1990s. We explain why the camps have reappeared after Vladimir Putin’s invasion of Ukraine  https://t.co/341hx7XqX2,en,[],[],5988062,5988062,TheEconomist,The Economist,3,14,https://twitter.com/TheEconomist/status/1557374263962882048,['https://econ.st/3Qx8Kvk'],[],0,,False,32,15,20,,None,,,,,,,[],,,,
622,1557369327220842497,1557369327220842497,1660140756000.0,2022-08-10 14:12:36,+0000,,Pyra is a Thai musician known for her “dystopian pop”. On “The Intelligence” @tomvater discusses why she has fled her home country  https://t.co/dt6cDFlQYO  https://t.co/bXuucOf6qk,en,[],[],5988062,5988062,TheEconomist,The Economist,3,14,https://twitter.com/TheEconomist/status/1557369327220842497,['https://econ.st/3SQrSGC'],['https://pbs.twimg.com/tweet_video_thumb/FZzjI88WYAAbjfx.jpg'],1,https://pbs.twimg.com/tweet_video_thumb/FZzjI88WYAAbjfx.jpg,False,21,3,7,,None,,,,,,,[],,,,
